<?xml version="1.0" encoding="UTF-8"?>




<LOGGING xmlns:xsi="http://www.w3.org/2001/XMLSchema-instance"
    xsi:noNamespaceSchemaLocation="logging.xsd">
    <LEVELS>
        <LOGLEVEL>
            <LEVEL>FATAL</LEVEL>
        </LOGLEVEL>
        <LOGLEVEL>
            <LEVEL>ERROR</LEVEL>
        </LOGLEVEL>
        <LOGLEVEL>
            <LEVEL>WARNING</LEVEL>
        </LOGLEVEL>
        <LOGLEVEL>
            <LEVEL>INFO</LEVEL>
        </LOGLEVEL>
        <LOGLEVEL>
            <LEVEL>DEBUG</LEVEL>
        </LOGLEVEL>
    </LEVELS>


    <SUBSYSTEMS>
        <SYSTEM>
            <NAME>FSM</NAME>
            <SHORT_NAME>FSM</SHORT_NAME>
            <TAG>--fsm</TAG>
            <TAG_SHORT>--fsm</TAG_SHORT>
            <DEFAULT>WARNING</DEFAULT>
            <CAN_MODIFY>true</CAN_MODIFY>
            <FORCE_OUTPUT>false</FORCE_OUTPUT>
        </SYSTEM>
        <SYSTEM>
            <NAME>MESSAGE</NAME>
            <SHORT_NAME>MSG</SHORT_NAME>
            <TAG>--message</TAG>
            <TAG_SHORT>--msg</TAG_SHORT>
            <DEFAULT>WARNING</DEFAULT>
            <CAN_MODIFY>true</CAN_MODIFY>
            <FORCE_OUTPUT>false</FORCE_OUTPUT>
        </SYSTEM>
        <SYSTEM>
            <NAME>COM</NAME>
            <SHORT_NAME>COM</SHORT_NAME>
            <TAG>--communication</TAG>
            <TAG_SHORT>--com</TAG_SHORT>
            <DEFAULT>WARNING</DEFAULT>
            <CAN_MODIFY>true</CAN_MODIFY>
            <FORCE_OUTPUT>false</FORCE_OUTPUT>
        </SYSTEM>        
        <SYSTEM> 
            <NAME>XML</NAME>
            <SHORT_NAME>XML</SHORT_NAME>
            <TAG>--xml</TAG>
            <TAG_SHORT>--xml</TAG_SHORT>
            <DEFAULT>WARNING</DEFAULT>
            <CAN_MODIFY>false</CAN_MODIFY>
            <FORCE_OUTPUT>false</FORCE_OUTPUT>
        </SYSTEM>
           <SYSTEM> 
            <NAME>DATABASE</NAME>
            <SHORT_NAME>DB</SHORT_NAME>
            <TAG>--database</TAG>
            <TAG_SHORT>--db</TAG_SHORT>
            <DEFAULT>WARNING</DEFAULT>
            <CAN_MODIFY>true</CAN_MODIFY>
            <FORCE_OUTPUT>false</FORCE_OUTPUT>
           </SYSTEM>
         <SYSTEM> 
            <NAME>JSON</NAME>
            <SHORT_NAME>JSON</SHORT_NAME>
            <TAG>--json</TAG>
            <TAG_SHORT>--j</TAG_SHORT>
            <DEFAULT>WARNING</DEFAULT>
            <CAN_MODIFY>true</CAN_MODIFY>
            <FORCE_OUTPUT>false</FORCE_OUTPUT>
         </SYSTEM>
           <SYSTEM> 
            <NAME>SHOTCAL</NAME>
            <SHORT_NAME>SC</SHORT_NAME>
            <TAG>--shotcal</TAG>
            <TAG_SHORT>--sc</TAG_SHORT>
            <DEFAULT>WARNING</DEFAULT>
            <CAN_MODIFY>true</CAN_MODIFY>
            <FORCE_OUTPUT>false</FORCE_OUTPUT>
         </SYSTEM>  
            <SYSTEM> 
            <NAME>SHOTEXCEC</NAME>
            <SHORT_NAME>SE</SHORT_NAME>
            <TAG>--shotexe</TAG>
            <TAG_SHORT>--se</TAG_SHORT>
            <DEFAULT>WARNING</DEFAULT>
            <CAN_MODIFY>true</CAN_MODIFY>
            <FORCE_OUTPUT>false</FORCE_OUTPUT>
         </SYSTEM>   
         <SYSTEM> 
            <NAME>CONFIGURATION</NAME>
            <SHORT_NAME>CONFIG</SHORT_NAME>
            <TAG>--configuration</TAG>
            <TAG_SHORT>--config</TAG_SHORT>
            <DEFAULT>WARNING</DEFAULT>
            <CAN_MODIFY>true</CAN_MODIFY>
            <FORCE_OUTPUT>false</FORCE_OUTPUT>
         </SYSTEM>   
         <SYSTEM> 
            <NAME>SENSOR</NAME>
            <SHORT_NAME>SENSOR</SHORT_NAME>
            <TAG>--sensor</TAG>
            <TAG_SHORT>--sensor</TAG_SHORT>
            <DEFAULT>WARNING</DEFAULT>
            <CAN_MODIFY>true</CAN_MODIFY>
            <FORCE_OUTPUT>false</FORCE_OUTPUT>
         </SYSTEM>
            <SYSTEM> 
            <NAME>CLI</NAME>
            <SHORT_NAME>CLI</SHORT_NAME>
            <TAG>--cli</TAG>
            <TAG_SHORT>--cli</TAG_SHORT>
            <DEFAULT>WARNING</DEFAULT>
            <CAN_MODIFY>true</CAN_MODIFY>
            <FORCE_OUTPUT>false</FORCE_OUTPUT>
            </SYSTEM>
            <SYSTEM> 
            <NAME>MCU</NAME>
            <SHORT_NAME>MCU</SHORT_NAME>
            <TAG>--mcu</TAG>
            <TAG_SHORT>--mcu</TAG_SHORT>
            <DEFAULT>WARNING</DEFAULT>
            <CAN_MODIFY>true</CAN_MODIFY>
            <FORCE_OUTPUT>false</FORCE_OUTPUT>
            </SYSTEM>
            

    </SUBSYSTEMS>

</LOGGING>
