<?xml version="1.0" encoding="UTF-8"?>

<LOGGING xmlns:xsi="http://www.w3.org/2001/XMLSchema-instance"
    xsi:noNamespaceSchemaLocation="logging.xsd">
    <LEVELS>
        <LOGLEVEL>
            <LEVEL>FATAL</LEVEL>
        </LOGLEVEL>
        <LOGLEVEL>
            <LEVEL>ERROR</LEVEL>
        </LOGLEVEL>
        <LOGLEVEL>
            <LEVEL>WARNING</LEVEL>
        </LOGLEVEL>
        <LOGLEVEL>
            <LEVEL>INFO</LEVEL>
        </LOGLEVEL>
        <LOGLEVEL>
            <LEVEL>DEBUG</LEVEL>
        </LOGLEVEL>
        <LOGLEVEL>
            <LEVEL>FORCE_DEBUG</LEVEL>
        </LOGLEVEL>
    </LEVELS>
    
    <SUBSYSTEMS>
        <SYSTEM>
            <NAME>EXCEPTION</NAME>
            <SHORT_NAME>EX</SHORT_NAME>
            <TAG>--exception</TAG>
            <TAG_SHORT>--ex</TAG_SHORT>
            <DEFAULT>ERROR</DEFAULT>
            <CAN_MODIFY>false</CAN_MODIFY>
            <FORCE_OUTPUT>false</FORCE_OUTPUT>
        </SYSTEM>
        <SYSTEM>
            <NAME>FSM</NAME>
            <SHORT_NAME>FSM</SHORT_NAME>
            <TAG>--fsm</TAG>
            <TAG_SHORT>--fsm</TAG_SHORT>
            <DEFAULT>WARNING</DEFAULT>
            <CAN_MODIFY>true</CAN_MODIFY>
            <FORCE_OUTPUT>false</FORCE_OUTPUT>
        </SYSTEM>
        <SYSTEM>
            <NAME>MEASUREMENT</NAME>
            <SHORT_NAME>MEAS</SHORT_NAME>
            <TAG>--measurement</TAG>
            <TAG_SHORT>--meas</TAG_SHORT>
            <DEFAULT>WARNING</DEFAULT>
            <CAN_MODIFY>true</CAN_MODIFY>
            <FORCE_OUTPUT>false</FORCE_OUTPUT>
        </SYSTEM>
        <SYSTEM>
            <NAME>CLI</NAME>
            <SHORT_NAME>CLI</SHORT_NAME>
            <TAG>--cli</TAG>
            <TAG_SHORT>--cli</TAG_SHORT>
            <DEFAULT>WARNING</DEFAULT>
            <CAN_MODIFY>true</CAN_MODIFY>
            <FORCE_OUTPUT>false</FORCE_OUTPUT>
        </SYSTEM>        
         <SYSTEM>
            <NAME>FOC</NAME>
            <SHORT_NAME>FOC</SHORT_NAME>
            <TAG>--foc</TAG>
            <TAG_SHORT>--foc</TAG_SHORT>
            <DEFAULT>WARNING</DEFAULT>
            <CAN_MODIFY>true</CAN_MODIFY>
            <FORCE_OUTPUT>false</FORCE_OUTPUT>
        </SYSTEM>
         <SYSTEM>
            <NAME>COM</NAME>
            <SHORT_NAME>COM</SHORT_NAME>
            <TAG>--com</TAG>
            <TAG_SHORT>--com</TAG_SHORT>
            <DEFAULT>WARNING</DEFAULT>
            <CAN_MODIFY>true</CAN_MODIFY>
            <FORCE_OUTPUT>false</FORCE_OUTPUT>
        </SYSTEM>      
        <SYSTEM> 
            <NAME>XML</NAME>
            <SHORT_NAME>XML</SHORT_NAME>
            <TAG>--xml</TAG>
            <TAG_SHORT>--xml</TAG_SHORT>
            <DEFAULT>WARNING</DEFAULT>
            <CAN_MODIFY>true</CAN_MODIFY>
            <FORCE_OUTPUT>false</FORCE_OUTPUT>
        </SYSTEM>
           <SYSTEM> 
            <NAME>DATABASE</NAME>
            <SHORT_NAME>DB</SHORT_NAME>
            <TAG>--database</TAG>
            <TAG_SHORT>--db</TAG_SHORT>
            <DEFAULT>WARNING</DEFAULT>
            <CAN_MODIFY>true</CAN_MODIFY>
            <FORCE_OUTPUT>false</FORCE_OUTPUT>
          </SYSTEM>
        <SYSTEM> 
            <NAME>USER</NAME>
            <SHORT_NAME>USR</SHORT_NAME>
            <TAG>--user</TAG>
            <TAG_SHORT>--usr</TAG_SHORT>
            <DEFAULT>WARNING</DEFAULT>
            <CAN_MODIFY>true</CAN_MODIFY>
            <FORCE_OUTPUT>false</FORCE_OUTPUT>
        </SYSTEM>
        <SYSTEM> 
            <NAME>GENERAL</NAME>
            <SHORT_NAME>G</SHORT_NAME>
            <TAG>--general</TAG>
            <TAG_SHORT>--gen</TAG_SHORT>
            <DEFAULT>WARNING</DEFAULT>
            <CAN_MODIFY>true</CAN_MODIFY>
            <FORCE_OUTPUT>false</FORCE_OUTPUT>
        </SYSTEM>
        <SYSTEM> 
            <NAME>ALARM</NAME>
            <SHORT_NAME>ALARM</SHORT_NAME>
            <TAG>--alarm</TAG>
            <TAG_SHORT>--alarm</TAG_SHORT>
            <DEFAULT>WARNING</DEFAULT>
            <CAN_MODIFY>false</CAN_MODIFY>
            <FORCE_OUTPUT>false</FORCE_OUTPUT>
        </SYSTEM>
    </SUBSYSTEMS>

</LOGGING>
